code,description,hs4_code,hs2_code,value
010121,Pure-bred breeding horses,0101,01,2500
010129,Live horses other than breeding,0101,01,2500
270900,Petroleum oils crude,2709,27,85000
271011,Light oils and preparations,2710,27,22000
271019,Other petroleum oils not crude,2710,27,18000
847130,Portable automatic data processing machines,8471,84,35000
847150,Processing units other than 8471.41 or 8471.49,8471,84,21000
851712,Telephones for cellular networks,8517,85,62000
851762,Machines for reception conversion and transmission of voice or data,8517,85,10000 